{
  "id": "00000000-0000-4000-8000-000000000037",
  "numberLabel": "37bis",
  "numberNumeric": 37,
  "numberSuffix": "bis",
  "title": "Ligne d'ouverture de test",
  "openingLine": "Ligne d'ouverture de test,",
  "languageCode": "fr",
  "sections": [
    {
      "id": "00000000-0000-4000-8000-000000000101",
      "type": "verse",
      "number": 1,
      "order": 0,
      "lines": [
        { "text": "Ligne d'ouverture de test,", "repeat": null },
        { "text": "Deuxième ligne répétée. (bis)", "repeat": { "count": 2, "marker": "(bis)" } }
      ]
    },
    {
      "id": "00000000-0000-4000-8000-000000000102",
      "type": "refrain",
      "number": null,
      "order": 1,
      "lines": [
        {
          "text": "Ligne de refrain chantée trois fois (ter)",
          "repeat": { "count": 3, "marker": "(ter)" }
        }
      ]
    }
  ],
  "bibleReferences": [
    {
      "displayText": "Psaumes 150",
      "book": "Psaumes",
      "chapterStart": 150,
      "verseStart": null,
      "chapterEnd": null,
      "verseEnd": null
    }
  ],
  "relations": [{ "type": "bis_of", "relatedHymnId": "00000000-0000-4000-8000-000000000036" }],
  "people": [],
  "themes": []
}
